{
  "coverage": "brain",
  "dataset_id": "fafb_v783",
  "files": [
    {
      "format": "csv.gz",
      "path": "data/raw/fafb_v783/classification.csv.gz",
      "reason": "Primary metadata file containing root_id, flow, super_class, class, sub_class, hemilineage, side.",
      "role": "neuron_metadata",
      "sha256": "e946b552f4056dfc977707be0674609832c3f64332a22d69dc0d9615e7aae663",
      "size_bytes": 934402,
      "source_url": "https://codex.flywire.ai/api/download?dataset=fafb"
    },
    {
      "format": "csv.gz",
      "path": "data/raw/fafb_v783/consolidated_cell_types.csv.gz",
      "reason": "Contains root_id, primary_type, additional_type(s).",
      "role": "annotations",
      "sha256": "8aba246d71dc40361677493629972ce3883048c3d02010adc42bda22962a1a2d",
      "size_bytes": 901707,
      "source_url": "https://codex.flywire.ai/api/download?dataset=fafb"
    },
    {
      "format": "csv.gz",
      "path": "data/raw/fafb_v783/names.csv.gz",
      "reason": "Contains root_id, name, group.",
      "role": "annotations",
      "sha256": "e541ef9ef4b9e62d798f165ae76853d15b84174cf1dce95392f313a491055332",
      "size_bytes": 1181576,
      "source_url": "https://codex.flywire.ai/api/download?dataset=fafb"
    },
    {
      "format": "csv.gz",
      "path": "data/raw/fafb_v783/neurons.csv.gz",
      "reason": "Contains neurotransmitter predictions and confidence scores.",
      "role": "annotations",
      "sha256": "6a6b3759e635f0f35a677d169052362131ec61d95f55919298b55c43fce4e719",
      "size_bytes": 1679884,
      "source_url": "https://codex.flywire.ai/api/download?dataset=fafb"
    },
    {
      "format": "csv.gz",
      "path": "data/raw/fafb_v783/connections_princeton.csv.gz",
      "reason": "The standard thresholded consensus graph.",
      "role": "connectivity",
      "sha256": "445f996bf6c4b1803b9ba186189138a3061ff8623aa94c0abcf38af30a5bd48b",
      "size_bytes": 68456801,
      "source_url": "https://codex.flywire.ai/api/download?dataset=fafb"
    }
  ],
  "license": "CC BY-NC 4.0",
  "name": "FlyWire FAFB adult female brain",
  "retrieved_at": "2026-09-26T16:53:35.215416+00:00",
  "sex": "female",
  "source_id": "DATA-001",
  "source_url": "https://codex.flywire.ai/api/download?dataset=fafb",
  "version": "v783"
}
